{
  "app_id": "SYN",
  "attempt": 0,
  "created_at": "2026-07-28T00:00:00Z",
  "dependencies": [],
  "evidence_namespace": "SYN-P1-SQL_DATA-ORDERS",
  "input_paths": [
    "../../extracted/bundles/bundle-synthetic/code/access-sql"
  ],
  "instructions": [],
  "max_attempts": 2,
  "module_order": [
    "module-orders"
  ],
  "module_targets": [
    "module-orders"
  ],
  "phase_targets": [
    1
  ],
  "role": "sql_data",
  "run_id": "SYN-RUN",
  "status": "PENDING",
  "task_id": "SYN-W1-SQL-ORDERS",
  "token_budget": null,
  "wave_id": "wave1_source_extraction",
  "write_paths": [
    "work/sql_data/module-orders"
  ]
}
